exp_outputss/pip5_kl_classifier_history.csv

epoch,train_loss,train_acc,train_f1,val_loss,val_acc,val_f1
1,0.806736840406064,0.6567040265670403,0.6538634403228971,0.923149923676426,0.5631067961165048,0.4053491889262732
2,0.5296862240201856,0.7683686176836861,0.7610479216663798,0.8415231658417044,0.5805825242718446,0.41544347789531477
3,0.45323474583362533,0.8082191780821918,0.8065886049728446,0.7519498428094734,0.6504854368932039,0.2888574498325311
4,0.44162202111513793,0.8119551681195517,0.8084220365065145,0.7947356446275433,0.6485436893203883,0.3276962524654833
5,0.36874841708471884,0.8439186384391864,0.837023619518309,0.7204122581528228,0.7048543689320388,0.33382774104441915
6,0.33482529362141716,0.8625985886259859,0.8664452174866797,1.049382784065691,0.5145631067961165,0.2794031123605494
7,0.297423916258422,0.8821087588210876,0.8805908386638344,0.7514657286764349,0.7145631067961165,0.33752806111815736
8,0.295379748503763,0.8758821087588211,0.8743117066703812,0.708266991781957,0.7436893203883496,0.45808926705478437
9,0.26906483145658777,0.8937318389373183,0.8962052799445269,0.8202928420409415,0.7126213592233009,0.33095975701333324
10,0.2577825116017588,0.9007887090078871,0.8971227145663743,1.286167224634041,0.5106796116504855,0.27798111792245417
11,0.22703692402989106,0.9111664591116646,0.9071793631127321,0.9196243563902031,0.6679611650485436,0.32202365620067896
12,0.22174766319527472,0.9157326691573267,0.9157047878457117,0.7477217148808599,0.7708737864077669,0.34346852599109945

Experiment 1 Pooled KL Classifier.md

--- Per-joint KL experiment: pip5 ---
Epoch 01 | train_loss=0.8067 train_acc=0.6567 train_f1=0.6539 | val_loss=0.9231 val_acc=0.5631 val_f1=0.4053
Epoch 02 | train_loss=0.5297 train_acc=0.7684 train_f1=0.7610 | val_loss=0.8415 val_acc=0.5806 val_f1=0.4154
Epoch 03 | train_loss=0.4532 train_acc=0.8082 train_f1=0.8066 | val_loss=0.7519 val_acc=0.6505 val_f1=0.2889
Epoch 04 | train_loss=0.4416 train_acc=0.8120 train_f1=0.8084 | val_loss=0.7947 val_acc=0.6485 val_f1=0.3277
Epoch 05 | train_loss=0.3687 train_acc=0.8439 train_f1=0.8370 | val_loss=0.7204 val_acc=0.7049 val_f1=0.3338
Epoch 06 | train_loss=0.3348 train_acc=0.8626 train_f1=0.8664 | val_loss=1.0494 val_acc=0.5146 val_f1=0.2794
Epoch 07 | train_loss=0.2974 train_acc=0.8821 train_f1=0.8806 | val_loss=0.7515 val_acc=0.7146 val_f1=0.3375
Epoch 08 | train_loss=0.2954 train_acc=0.8759 train_f1=0.8743 | val_loss=0.7083 val_acc=0.7437 val_f1=0.4581
Epoch 09 | train_loss=0.2691 train_acc=0.8937 train_f1=0.8962 | val_loss=0.8203 val_acc=0.7126 val_f1=0.3310
Epoch 10 | train_loss=0.2578 train_acc=0.9008 train_f1=0.8971 | val_loss=1.2862 val_acc=0.5107 val_f1=0.2780
Epoch 11 | train_loss=0.2270 train_acc=0.9112 train_f1=0.9072 | val_loss=0.9196 val_acc=0.6680 val_f1=0.3220
Epoch 12 | train_loss=0.2217 train_acc=0.9157 train_f1=0.9157 | val_loss=0.7477 val_acc=0.7709 val_f1=0.3435
[Best model saved] exp_outputs/pip5_kl_classifier.pt | best_val_f1=0.4581