exp_outputss/pip2_kl_classifier_history.csv

epoch,train_loss,train_acc,train_f1,val_loss,val_acc,val_f1
1,0.7764667959021574,0.6572731040198923,0.6563879043590426,0.7647514600020189,0.7153846153846154,0.32113043931440344
2,0.4994184309103358,0.7807708246995442,0.785355374103406,0.7305531483430129,0.7,0.3677711476273394
3,0.42276289888649526,0.8168255283878989,0.8164464625289192,0.9099139837118295,0.6134615384615385,0.33286429200553636
4,0.3640256479129325,0.8421052631578947,0.8360073997869716,0.9435035723906297,0.5788461538461539,0.34318146718146714
5,0.3436237180252763,0.8619975134687111,0.8604392752800758,0.7055019222773038,0.7365384615384616,0.31892936405258515
6,0.293700689912287,0.8843762950683796,0.8848307678002001,0.6271134596604567,0.7615384615384615,0.397128453180781
7,0.2767364731775593,0.8984666390385412,0.8979394912336293,0.7649315357208252,0.698076923076923,0.29381152450550024
8,0.2612665405151906,0.8968089515126398,0.8979427191421738,0.6689288840844081,0.7769230769230769,0.32162324383183283
9,0.2166750387277437,0.9117281392457521,0.9135961924645872,1.1277336459893448,0.6153846153846154,0.3006435176556844
10,0.19483372135264618,0.9237463738085371,0.9228534583856923,0.7720580321091872,0.7826923076923077,0.30234607607101005
11,0.1772307432567337,0.9332780770824699,0.9342088460936158,0.7397514091088222,0.7711538461538462,0.33587264051349186
12,0.1539631470099209,0.9415665147119768,0.9427378075230836,0.7757651209831238,0.7442307692307693,0.3058800235130822

Experiment 1 Pooled KL Classifier.md

--- Per-joint KL experiment: pip2 ---
Epoch 01 | train_loss=0.7765 train_acc=0.6573 train_f1=0.6564 | val_loss=0.7648 val_acc=0.7154 val_f1=0.3211
Epoch 02 | train_loss=0.4994 train_acc=0.7808 train_f1=0.7854 | val_loss=0.7306 val_acc=0.7000 val_f1=0.3678
Epoch 03 | train_loss=0.4228 train_acc=0.8168 train_f1=0.8164 | val_loss=0.9099 val_acc=0.6135 val_f1=0.3329
Epoch 04 | train_loss=0.3640 train_acc=0.8421 train_f1=0.8360 | val_loss=0.9435 val_acc=0.5788 val_f1=0.3432
Epoch 05 | train_loss=0.3436 train_acc=0.8620 train_f1=0.8604 | val_loss=0.7055 val_acc=0.7365 val_f1=0.3189
Epoch 06 | train_loss=0.2937 train_acc=0.8844 train_f1=0.8848 | val_loss=0.6271 val_acc=0.7615 val_f1=0.3971
Epoch 07 | train_loss=0.2767 train_acc=0.8985 train_f1=0.8979 | val_loss=0.7649 val_acc=0.6981 val_f1=0.2938
Epoch 08 | train_loss=0.2613 train_acc=0.8968 train_f1=0.8979 | val_loss=0.6689 val_acc=0.7769 val_f1=0.3216
Epoch 09 | train_loss=0.2167 train_acc=0.9117 train_f1=0.9136 | val_loss=1.1277 val_acc=0.6154 val_f1=0.3006
Epoch 10 | train_loss=0.1948 train_acc=0.9237 train_f1=0.9229 | val_loss=0.7721 val_acc=0.7827 val_f1=0.3023
Epoch 11 | train_loss=0.1772 train_acc=0.9333 train_f1=0.9342 | val_loss=0.7398 val_acc=0.7712 val_f1=0.3359
Epoch 12 | train_loss=0.1540 train_acc=0.9416 train_f1=0.9427 | val_loss=0.7758 val_acc=0.7442 val_f1=0.3059
[Best model saved] exp_outputs/pip2_kl_classifier.pt | best_val_f1=0.3971